[
  {
    "fp_version": "0.2",
    "world_epoch": "23c99a30-6b89-4816-8823-737c879e2a2a",
    "seq": 1,
    "tick": 29,
    "observed_at": "2026-09-16T04:43:37.5725366+00:00",
    "kind": "experiment_start",
    "entity_id": "0ad3ae2b-cef9-46d3-b916-21528dc29ae1",
    "origin": "mock-platform",
    "trace_id": "3056232e-b772-47d7-ae86-3d6cd9423022",
    "data": null
  },
  {
    "fp_version": "0.2",
    "world_epoch": "23c99a30-6b89-4816-8823-737c879e2a2a",
    "seq": 2,
    "tick": 37,
    "observed_at": "2026-09-16T04:43:38.318143+00:00",
    "kind": "upsert",
    "entity_id": "avatar/97af97dc-6bb3-4145-aeaf-f17cecd24318",
    "origin": "opensim",
    "trace_id": "",
    "data": {
      "entity_id": "avatar/97af97dc-6bb3-4145-aeaf-f17cecd24318",
      "source_id": "97af97dc-6bb3-4145-aeaf-f17cecd24318",
      "kind": "avatar",
      "position": [
        100,
        100,
        1.9618906
      ],
      "rotation": [
        0,
        0,
        0,
        1
      ]
    }
  },
  {
    "fp_version": "0.2",
    "world_epoch": "23c99a30-6b89-4816-8823-737c879e2a2a",
    "seq": 3,
    "tick": 37,
    "observed_at": "2026-09-16T04:43:38.3198767+00:00",
    "kind": "action_receipt",
    "entity_id": "request/fbb541bf-e082-43b2-9b0f-628aa2cb0ce4",
    "origin": "mock-platform",
    "trace_id": "3056232e-b772-47d7-ae86-3d6cd9423022",
    "data": {
      "fp_version": "0.2",
      "world_id": "093e33cc-a504-4a1f-bd56-e2836218c1d7",
      "region_id": "093e33cc-a504-4a1f-bd56-e2836218c1d7",
      "source_runtime": "opensim-0.9.3.0",
      "world_epoch": "23c99a30-6b89-4816-8823-737c879e2a2a",
      "request_id": "fbb541bf-e082-43b2-9b0f-628aa2cb0ce4",
      "trace_id": "3056232e-b772-47d7-ae86-3d6cd9423022",
      "operation": "AgentSpawn",
      "state": "completed",
      "error": "",
      "tick": 37,
      "event_seq": 2,
      "observed_at": "2026-09-16T04:43:38.3198758+00:00",
      "data": {
        "observed": true,
        "avatar_present": true,
        "position": [
          100,
          100,
          1.9618906
        ],
        "rotation": [
          0,
          0,
          0,
          1
        ]
      }
    }
  },
  {
    "fp_version": "0.2",
    "world_epoch": "23c99a30-6b89-4816-8823-737c879e2a2a",
    "seq": 4,
    "tick": 38,
    "observed_at": "2026-09-16T04:43:38.3699004+00:00",
    "kind": "upsert",
    "entity_id": "avatar/97af97dc-6bb3-4145-aeaf-f17cecd24318",
    "origin": "opensim",
    "trace_id": "",
    "data": {
      "entity_id": "avatar/97af97dc-6bb3-4145-aeaf-f17cecd24318",
      "source_id": "97af97dc-6bb3-4145-aeaf-f17cecd24318",
      "kind": "avatar",
      "position": [
        100,
        100,
        1.8426256
      ],
      "rotation": [
        0,
        0,
        0,
        1
      ]
    }
  },
  {
    "fp_version": "0.2",
    "world_epoch": "23c99a30-6b89-4816-8823-737c879e2a2a",
    "seq": 5,
    "tick": 39,
    "observed_at": "2026-09-16T04:43:38.4603071+00:00",
    "kind": "upsert",
    "entity_id": "avatar/97af97dc-6bb3-4145-aeaf-f17cecd24318",
    "origin": "opensim",
    "trace_id": "",
    "data": {
      "entity_id": "avatar/97af97dc-6bb3-4145-aeaf-f17cecd24318",
      "source_id": "97af97dc-6bb3-4145-aeaf-f17cecd24318",
      "kind": "avatar",
      "position": [
        100,
        100,
        1.6423415
      ],
      "rotation": [
        0,
        0,
        0,
        1
      ]
    }
  },
  {
    "fp_version": "0.2",
    "world_epoch": "23c99a30-6b89-4816-8823-737c879e2a2a",
    "seq": 6,
    "tick": 40,
    "observed_at": "2026-09-16T04:43:38.5512857+00:00",
    "kind": "upsert",
    "entity_id": "avatar/97af97dc-6bb3-4145-aeaf-f17cecd24318",
    "origin": "opensim",
    "trace_id": "",
    "data": {
      "entity_id": "avatar/97af97dc-6bb3-4145-aeaf-f17cecd24318",
      "source_id": "97af97dc-6bb3-4145-aeaf-f17cecd24318",
      "kind": "avatar",
      "position": [
        100,
        100,
        1.3611524
      ],
      "rotation": [
        0,
        0,
        0,
        1
      ]
    }
  },
  {
    "fp_version": "0.2",
    "world_epoch": "23c99a30-6b89-4816-8823-737c879e2a2a",
    "seq": 7,
    "tick": 41,
    "observed_at": "2026-09-16T04:43:38.6579326+00:00",
    "kind": "upsert",
    "entity_id": "avatar/97af97dc-6bb3-4145-aeaf-f17cecd24318",
    "origin": "opensim",
    "trace_id": "",
    "data": {
      "entity_id": "avatar/97af97dc-6bb3-4145-aeaf-f17cecd24318",
      "source_id": "97af97dc-6bb3-4145-aeaf-f17cecd24318",
      "kind": "avatar",
      "position": [
        100.08318,
        100,
        1.0530812
      ],
      "rotation": [
        0,
        0,
        0,
        1
      ]
    }
  },
  {
    "fp_version": "0.2",
    "world_epoch": "23c99a30-6b89-4816-8823-737c879e2a2a",
    "seq": 8,
    "tick": 42,
    "observed_at": "2026-09-16T04:43:38.7363206+00:00",
    "kind": "upsert",
    "entity_id": "avatar/97af97dc-6bb3-4145-aeaf-f17cecd24318",
    "origin": "opensim",
    "trace_id": "",
    "data": {
      "entity_id": "avatar/97af97dc-6bb3-4145-aeaf-f17cecd24318",
      "source_id": "97af97dc-6bb3-4145-aeaf-f17cecd24318",
      "kind": "avatar",
      "position": [
        100.23048,
        100,
        1.0780673
      ],
      "rotation": [
        0,
        0,
        0,
        1
      ]
    }
  },
  {
    "fp_version": "0.2",
    "world_epoch": "23c99a30-6b89-4816-8823-737c879e2a2a",
    "seq": 9,
    "tick": 43,
    "observed_at": "2026-09-16T04:43:38.8284286+00:00",
    "kind": "upsert",
    "entity_id": "avatar/97af97dc-6bb3-4145-aeaf-f17cecd24318",
    "origin": "opensim",
    "trace_id": "",
    "data": {
      "entity_id": "avatar/97af97dc-6bb3-4145-aeaf-f17cecd24318",
      "source_id": "97af97dc-6bb3-4145-aeaf-f17cecd24318",
      "kind": "avatar",
      "position": [
        100.390686,
        100,
        1.1076978
      ],
      "rotation": [
        0,
        0,
        0,
        1
      ]
    }
  },
  {
    "fp_version": "0.2",
    "world_epoch": "23c99a30-6b89-4816-8823-737c879e2a2a",
    "seq": 10,
    "tick": 44,
    "observed_at": "2026-09-16T04:43:38.9202508+00:00",
    "kind": "upsert",
    "entity_id": "avatar/97af97dc-6bb3-4145-aeaf-f17cecd24318",
    "origin": "opensim",
    "trace_id": "",
    "data": {
      "entity_id": "avatar/97af97dc-6bb3-4145-aeaf-f17cecd24318",
      "source_id": "97af97dc-6bb3-4145-aeaf-f17cecd24318",
      "kind": "avatar",
      "position": [
        100.60732,
        100,
        1.0833135
      ],
      "rotation": [
        0,
        0,
        0,
        1
      ]
    }
  },
  {
    "fp_version": "0.2",
    "world_epoch": "23c99a30-6b89-4816-8823-737c879e2a2a",
    "seq": 11,
    "tick": 45,
    "observed_at": "2026-09-16T04:43:39.0123891+00:00",
    "kind": "upsert",
    "entity_id": "avatar/97af97dc-6bb3-4145-aeaf-f17cecd24318",
    "origin": "opensim",
    "trace_id": "",
    "data": {
      "entity_id": "avatar/97af97dc-6bb3-4145-aeaf-f17cecd24318",
      "source_id": "97af97dc-6bb3-4145-aeaf-f17cecd24318",
      "kind": "avatar",
      "position": [
        100.82755,
        100,
        1.0880095
      ],
      "rotation": [
        0,
        0,
        0,
        1
      ]
    }
  },
  {
    "fp_version": "0.2",
    "world_epoch": "23c99a30-6b89-4816-8823-737c879e2a2a",
    "seq": 12,
    "tick": 46,
    "observed_at": "2026-09-16T04:43:39.1059776+00:00",
    "kind": "upsert",
    "entity_id": "avatar/97af97dc-6bb3-4145-aeaf-f17cecd24318",
    "origin": "opensim",
    "trace_id": "",
    "data": {
      "entity_id": "avatar/97af97dc-6bb3-4145-aeaf-f17cecd24318",
      "source_id": "97af97dc-6bb3-4145-aeaf-f17cecd24318",
      "kind": "avatar",
      "position": [
        101.04796,
        100,
        1.0894121
      ],
      "rotation": [
        0,
        0,
        0,
        1
      ]
    }
  },
  {
    "fp_version": "0.2",
    "world_epoch": "23c99a30-6b89-4816-8823-737c879e2a2a",
    "seq": 13,
    "tick": 47,
    "observed_at": "2026-09-16T04:43:39.2008039+00:00",
    "kind": "upsert",
    "entity_id": "avatar/97af97dc-6bb3-4145-aeaf-f17cecd24318",
    "origin": "opensim",
    "trace_id": "",
    "data": {
      "entity_id": "avatar/97af97dc-6bb3-4145-aeaf-f17cecd24318",
      "source_id": "97af97dc-6bb3-4145-aeaf-f17cecd24318",
      "kind": "avatar",
      "position": [
        101.26845,
        100,
        1.089825
      ],
      "rotation": [
        0,
        0,
        0,
        1
      ]
    }
  },
  {
    "fp_version": "0.2",
    "world_epoch": "23c99a30-6b89-4816-8823-737c879e2a2a",
    "seq": 14,
    "tick": 48,
    "observed_at": "2026-09-16T04:43:39.2793894+00:00",
    "kind": "upsert",
    "entity_id": "avatar/97af97dc-6bb3-4145-aeaf-f17cecd24318",
    "origin": "opensim",
    "trace_id": "",
    "data": {
      "entity_id": "avatar/97af97dc-6bb3-4145-aeaf-f17cecd24318",
      "source_id": "97af97dc-6bb3-4145-aeaf-f17cecd24318",
      "kind": "avatar",
      "position": [
        101.48891,
        100,
        1.0899479
      ],
      "rotation": [
        0,
        0,
        0,
        1
      ]
    }
  },
  {
    "fp_version": "0.2",
    "world_epoch": "23c99a30-6b89-4816-8823-737c879e2a2a",
    "seq": 15,
    "tick": 49,
    "observed_at": "2026-09-16T04:43:39.3732169+00:00",
    "kind": "upsert",
    "entity_id": "avatar/97af97dc-6bb3-4145-aeaf-f17cecd24318",
    "origin": "opensim",
    "trace_id": "",
    "data": {
      "entity_id": "avatar/97af97dc-6bb3-4145-aeaf-f17cecd24318",
      "source_id": "97af97dc-6bb3-4145-aeaf-f17cecd24318",
      "kind": "avatar",
      "position": [
        101.70483,
        100.00456,
        1.0890362
      ],
      "rotation": [
        0,
        0,
        0,
        1
      ]
    }
  },
  {
    "fp_version": "0.2",
    "world_epoch": "23c99a30-6b89-4816-8823-737c879e2a2a",
    "seq": 16,
    "tick": 50,
    "observed_at": "2026-09-16T04:43:39.4663919+00:00",
    "kind": "upsert",
    "entity_id": "avatar/97af97dc-6bb3-4145-aeaf-f17cecd24318",
    "origin": "opensim",